{
  "$schema": "http://json-schema.org/draft-07/schema#",
  "$id": "https://github.com/jimmywuxin/token-eye/blob/main/schema/providers.schema.json",
  "title": "Token Eye providers.json",
  "description": "Token Eye 插件配置：定义所有平台（parser / api / display / alert）。支持 JSON Schema 的编辑器（VS Code 等）可自动补全与校验。运行时校验见 scripts/validate-schema.py（零依赖实现本 schema 所用到的子集）。",
  "type": "object",
  "properties": {
    "providers": {
      "type": "array",
      "description": "平台列表，按顺序展示",
      "items": { "$ref": "#/definitions/provider" }
    },
    "colors": {
      "type": "object",
      "description": "深浅模式配色（WCAG AA ≥4.5:1）",
      "properties": {
        "dark": { "$ref": "#/definitions/colorSet" },
        "light": { "$ref": "#/definitions/colorSet" }
      }
    },
    "cache": {
      "type": "object",
      "description": "按 parser 类型的缓存 TTL（秒）",
      "properties": {
        "balance": { "type": "integer", "minimum": 1 },
        "plan_usage": { "type": "integer", "minimum": 1 },
        "status": { "type": "integer", "minimum": 1 }
      },
      "additionalProperties": true
    },
    "menuBar": {
      "type": "object",
      "description": "菜单栏汇总显示",
      "properties": {
        "showSummary": {
          "description": "false 不显示 / true 全部 / id 数组只显示指定平台",
          "oneOf": [
            { "type": "boolean" },
            { "type": "array", "items": { "type": "string" } }
          ]
        }
      },
      "additionalProperties": true
    },
    "alerts": {
      "type": "object",
      "description": "按 provider id 的全局告警配置（与 provider 内 alert 等价）",
      "additionalProperties": { "$ref": "#/definitions/alert" }
    }
  },
  "required": ["providers"],
  "additionalProperties": true,
  "definitions": {
    "provider": {
      "type": "object",
      "required": ["id", "name", "keychainService", "api", "parser"],
      "properties": {
        "id": { "type": "string", "minLength": 1 },
        "name": { "type": "string", "minLength": 1 },
        "keychainService": {
          "type": "string",
          "description": "Keychain 服务名，约定 <平台名大写>_API_KEY"
        },
        "consoleUrl": { "type": "string" },
        "cacheTtl": { "type": "integer", "minimum": 1 },
        "enabled": { "type": "boolean" },
        "refreshParam": {
          "type": "string",
          "description": "鉴权错误时自动刷新 + 菜单手动刷新的脚本名（scripts/<refreshParam>.py）"
        },
        "refreshInterval": {
          "type": "integer",
          "minimum": 60,
          "description": "主动续期周期（秒）：即使 cookie 仍有效也定期从浏览器复制最新 cookie，保持 keychain 与浏览器会话同步，减少 401 触发面（仅对配置了 refreshParam 的 provider 生效）"
        },
        "api": { "$ref": "#/definitions/api" },
        "parser": { "$ref": "#/definitions/parser" },
        "display": { "$ref": "#/definitions/display" },
        "alert": { "$ref": "#/definitions/alert" }
      },
      "additionalProperties": true
    },
    "api": {
      "type": "object",
      "required": ["url"],
      "properties": {
        "url": { "type": "string", "minLength": 1 },
        "method": { "type": "string", "enum": ["GET", "POST", "PUT", "DELETE"] },
        "authHeader": { "type": "string", "default": "Authorization" },
        "authPrefix": { "type": "string", "default": "Bearer " },
        "headers": {
          "type": "object",
          "additionalProperties": { "type": "string" }
        },
        "envelope": {
          "type": "object",
          "description": "业务码校验：国内平台常用 HTTP 200 + body.code 表达错误（如智谱 code=401 表示令牌失效）。配置后非 okCodes 的响应改判为鉴权错误，避免渲染成「✅ ¥?」假绿。不配则只看 HTTP 码。",
          "properties": {
            "codePath": { "type": "string", "default": "code", "description": "业务码字段路径" },
            "okCodes": {
              "type": "array",
              "items": { "description": "视为成功的业务码（数字或字符串，按字符串比对）" },
              "default": [200],
              "description": "视为成功的业务码（按字符串比对）"
            },
            "msgPath": { "type": "string", "default": "msg", "description": "错误文案字段路径" }
          },
          "additionalProperties": true
        }
      },
      "additionalProperties": true
    },
    "parser": {
      "type": "object",
      "required": ["type"],
      "properties": {
        "type": { "type": "string", "enum": ["balance", "plan_usage", "status"] },
        "fields": {
          "type": "object",
          "description": "字段路径映射，支持 . 分隔嵌套与数组索引（如 balance_infos.0.total_balance）。balance 类可配 alertThreshold 指向 API 返回的告警阈值字段（若平台返回），用于自动读阈值",
          "additionalProperties": { "type": "string" }
        },
        "defaultMinBalance": {
          "type": "number",
          "minimum": 0,
          "description": "balance 类余额告警阈值兜底值（按 parser 类型）。优先级链：API 阈值字段（parser.fields.alertThreshold）> provider.alert.minBalance > 此处 > 不告警"
        },
        "arrayPath": { "type": "string" },
        "modelLabels": { "type": "object" },
        "showModels": { "type": "array", "items": { "type": "string" } },
        "statusMap": {
          "type": "object",
          "description": "状态码 -> 文案，默认 {1:可用, 2:耗尽临近, 3:耗尽}"
        },
        "windowLabels": {
          "type": "object",
          "description": "plan_usage 详情菜单行首的窗口显示名，默认 {\"interval\":\"5h\",\"weekly\":\"7d\"}",
          "properties": {
            "interval": { "type": "string" },
            "weekly": { "type": "string" }
          },
          "additionalProperties": true
        },
        "pctDirection": {
          "type": "string",
          "enum": ["remaining", "used"],
          "description": "fields.intervalPct / weeklyPct 源数据的口径：remaining 表示剩余%（解析层会翻转为已用%渲染），used 表示已是已用%（直接用）。默认 remaining（兼容 MiniMax 等历史 provider）。"
        },
        "barLength": { "type": "integer", "minimum": 1 },
        "noQuotaLabel": { "type": "string" },
        "okField": { "type": "string" },
        "okValue": {},
        "peakWindow": {
          "type": "object",
          "description": "峰/谷时段规则（客户端按本地时区自行判定，如 DeepSeek 峰谷定价）。hours 为左闭右开区间 [start,end) 本地小时；weekdays 为 isoweekday 1=周一..7=周日；holidays=true 时叠加 holidays/<年>.json 的中国法定节假日/调休表（调休上班日按工作日算）",
          "properties": {
            "tz": { "type": "string", "default": "Asia/Shanghai", "description": "IANA 时区名" },
            "weekdays": {
              "type": "array",
              "items": { "type": "integer", "minimum": 1, "maximum": 7 },
              "default": [1, 2, 3, 4, 5]
            },
            "hours": {
              "type": "array",
              "items": {
                "type": "array",
                "items": { "type": "integer" },
                "minItems": 2,
                "maxItems": 2
              },
              "examples": [[[9, 12], [14, 18]]]
            },
            "peakLabel": { "type": "string", "default": "⚡高峰" },
            "offPeakLabel": { "type": "string", "default": "🌙空闲" },
            "holidays": {
              "type": "boolean",
              "default": false,
              "description": "是否叠加中国法定节假日/调休表（holidays/<年>.json）：节假日全天空闲，调休上班的周末按工作日算；无数据文件时自动退化为纯 weekdays 判定"
            }
          },
          "additionalProperties": true
        }
      },
      "additionalProperties": true
    },
    "display": {
      "type": "object",
      "properties": {
        "unit": { "type": "string" },
        "label": { "type": "string" },
        "showDerived": {
          "type": "boolean",
          "default": true,
          "description": "balance 类是否显示派生统计（今日消耗/预计可用、近 7 天柱状）。false = 只显示余额；快照历史仍照常累积，dailySpendMax/daysLeft 告警不受影响"
        },
        "currencySymbols": {
          "type": "object",
          "description": "货币符号映射（如 {\"USD\":\"$\",\"EUR\":\"€\"}），未配置时默认 USD→$ 其余→¥",
          "additionalProperties": { "type": "string" }
        },
        "nameColor": {
          "description": "平台名颜色：字符串（旧版兼容）或深浅双套",
          "oneOf": [
            { "type": "string" },
            {
              "type": "object",
              "properties": {
                "dark": { "type": "string" },
                "light": { "type": "string" }
              },
              "additionalProperties": true
            }
          ]
        }
      },
      "additionalProperties": true
    },
    "alert": {
      "type": "object",
      "description": "告警阈值（balance 用 minBalance / dailySpendMax / daysLeft，plan_usage 用 minPct）",
      "properties": {
        "minBalance": { "type": "number" },
        "minPct": { "type": "number" },
        "dailySpendMax": {
          "type": "number",
          "description": "balance：当日消耗超过该值时告警（基于余额快照差值估算）"
        },
        "daysLeft": {
          "type": "number",
          "description": "balance：按最近 24h 消耗速率外推，预计可用天数低于该值时告警"
        }
      },
      "additionalProperties": true
    },
    "colorSet": {
      "type": "object",
      "description": "一组 7 个状态颜色",
      "properties": {
        "default": { "type": "string" },
        "secondary": { "type": "string" },
        "muted": { "type": "string" },
        "header": { "type": "string" },
        "ok": { "type": "string" },
        "warn": { "type": "string" },
        "err": { "type": "string" }
      },
      "additionalProperties": true
    }
  }
}
